{
  "schemaVersion": 1,
  "source": "openspec/changes/archive/2026-07-31-typora-grade-live-preview-phase2/tasks.md",
  "description": "Unique ownership mapping from every phase-2 umbrella task ID (1.1-12.10) to exactly one child change and one owner. A task ID MUST appear only once; cross-child dependencies are expressed with dependsOn rather than a second owner.",
  "tasks": [
    { "task": "1.1", "owner": "@xian", "childChange": "r0a-baseline-governance" },
    { "task": "1.2", "owner": "@xian", "childChange": "r0a-baseline-governance" },
    { "task": "1.3", "owner": "@xian", "childChange": "r0a-baseline-governance" },
    { "task": "1.4", "owner": "@xian", "childChange": "r0a-baseline-governance" },
    { "task": "1.5", "owner": "@xian", "childChange": "r0a-baseline-governance" },
    { "task": "1.6", "owner": "@xian", "childChange": "r0a-baseline-governance" },
    { "task": "1.7", "owner": "@xian", "childChange": "r0a-baseline-governance" },
    { "task": "2.1", "owner": "@xian", "childChange": "r0b-parser-bridge-spike" },
    { "task": "2.2", "owner": "@xian", "childChange": "r0b-parser-bridge-spike" },
    { "task": "2.3", "owner": "@xian", "childChange": "r0b-parser-bridge-spike" },
    { "task": "2.4", "owner": "@xian", "childChange": "r0b-parser-bridge-spike" },
    { "task": "2.5", "owner": "@xian", "childChange": "r0b-parser-bridge-spike" },
    { "task": "2.6", "owner": "@xian", "childChange": "r0b-parser-bridge-spike" },
    { "task": "2.7", "owner": "@xian", "childChange": "r0b-parser-bridge-spike" },
    { "task": "2.8", "owner": "@xian", "childChange": "r0b-parser-bridge-spike" },
    { "task": "2.9", "owner": "@xian", "childChange": "r0b-parser-bridge-spike" },
    { "task": "2.10", "owner": "@xian", "childChange": "r0a-baseline-governance" },
    { "task": "3.1", "owner": "@xian", "childChange": "r0c-projection-correctness" },
    { "task": "3.2", "owner": "@xian", "childChange": "r0c-projection-correctness" },
    { "task": "3.3", "owner": "@xian", "childChange": "r0c-projection-correctness" },
    { "task": "3.4", "owner": "@xian", "childChange": "r0c-projection-correctness" },
    { "task": "3.5", "owner": "@xian", "childChange": "r0c-projection-correctness" },
    { "task": "3.6", "owner": "@xian", "childChange": "r0c-projection-correctness" },
    { "task": "3.7", "owner": "@xian", "childChange": "r0c-projection-correctness" },
    { "task": "3.8", "owner": "@xian", "childChange": "r0c-projection-correctness" },
    { "task": "3.9", "owner": "@xian", "childChange": "r0c-projection-correctness" },
    { "task": "3.10", "owner": "@xian", "childChange": "r0c-projection-correctness" },
    { "task": "4.1", "owner": "@xian", "childChange": "r1a-single-editor-surface" },
    { "task": "4.2", "owner": "@xian", "childChange": "r1a-single-editor-surface" },
    { "task": "4.3", "owner": "@xian", "childChange": "r1a-single-editor-surface" },
    { "task": "4.4", "owner": "@xian", "childChange": "r1a-single-editor-surface" },
    { "task": "4.5", "owner": "@xian", "childChange": "r1a-single-editor-surface" },
    { "task": "4.6", "owner": "@xian", "childChange": "r1a-single-editor-surface" },
    { "task": "4.7", "owner": "@xian", "childChange": "r1a-single-editor-surface" },
    { "task": "4.8", "owner": "@xian", "childChange": "r1a-single-editor-surface" },
    { "task": "5.1", "owner": "@xian", "childChange": "r1b-command-history" },
    { "task": "5.2", "owner": "@xian", "childChange": "r1b-command-history" },
    { "task": "5.3", "owner": "@xian", "childChange": "r1b-command-history" },
    { "task": "5.4", "owner": "@xian", "childChange": "r1b-command-history" },
    { "task": "5.5", "owner": "@xian", "childChange": "r1b-command-history" },
    { "task": "5.6", "owner": "@xian", "childChange": "r1b-command-history" },
    { "task": "5.7", "owner": "@xian", "childChange": "r1b-command-history" },
    { "task": "5.8", "owner": "@xian", "childChange": "r1b-command-history" },
    { "task": "5.9", "owner": "@xian", "childChange": "r1b-command-history" },
    { "task": "5.10", "owner": "@xian", "childChange": "r1b-command-history" },
    { "task": "6.1", "owner": "@xian", "childChange": "r2a-render-ir-v2" },
    { "task": "6.2", "owner": "@xian", "childChange": "r2a-render-ir-v2" },
    { "task": "6.3", "owner": "@xian", "childChange": "r2a-render-ir-v2" },
    { "task": "6.4", "owner": "@xian", "childChange": "r2a-render-ir-v2" },
    { "task": "6.5", "owner": "@xian", "childChange": "r2a-render-ir-v2" },
    { "task": "6.6", "owner": "@xian", "childChange": "r2a-render-ir-v2" },
    { "task": "6.7", "owner": "@xian", "childChange": "r2a-render-ir-v2" },
    { "task": "6.8", "owner": "@xian", "childChange": "r2a-render-ir-v2" },
    { "task": "6.9", "owner": "@xian", "childChange": "r2a-render-ir-v2" },
    { "task": "7.1", "owner": "@xian", "childChange": "r2b-live-preview" },
    { "task": "7.2", "owner": "@xian", "childChange": "r2b-live-preview" },
    { "task": "7.3", "owner": "@xian", "childChange": "r2b-live-preview" },
    { "task": "7.4", "owner": "@xian", "childChange": "r2b-live-preview" },
    { "task": "7.5", "owner": "@xian", "childChange": "r2b-live-preview" },
    { "task": "7.6", "owner": "@xian", "childChange": "r2b-live-preview" },
    { "task": "7.7", "owner": "@xian", "childChange": "r2b-live-preview" },
    { "task": "7.8", "owner": "@xian", "childChange": "r2b-live-preview" },
    { "task": "7.9", "owner": "@xian", "childChange": "r2b-live-preview" },
    { "task": "7.10", "owner": "@xian", "childChange": "r2b-live-preview" },
    { "task": "7.11", "owner": "@xian", "childChange": "r2b-live-preview" },
    { "task": "7.12", "owner": "@xian", "childChange": "r2b-live-preview" },
    { "task": "7.13", "owner": "@xian", "childChange": "r2b-live-preview" },
    { "task": "8.1", "owner": "@xian", "childChange": "r3a-task-code-widgets" },
    { "task": "8.2", "owner": "@xian", "childChange": "r3b-table-image-widgets" },
    { "task": "8.3", "owner": "@xian", "childChange": "r3b-table-image-widgets" },
    { "task": "8.4", "owner": "@xian", "childChange": "r3b-table-image-widgets" },
    { "task": "8.5", "owner": "@xian", "childChange": "r3b-table-image-widgets" },
    { "task": "8.6", "owner": "@xian", "childChange": "r3b-table-image-widgets" },
    { "task": "8.7", "owner": "@xian", "childChange": "r3a-task-code-widgets" },
    { "task": "8.8", "owner": "@xian", "childChange": "r3a-task-code-widgets" },
    { "task": "8.9", "owner": "@xian", "childChange": "r3c-frontmatter-diagram-html" },
    { "task": "8.10", "owner": "@xian", "childChange": "r3c-frontmatter-diagram-html" },
    { "task": "8.11", "owner": "@xian", "childChange": "r3c-frontmatter-diagram-html" },
    { "task": "8.12", "owner": "@xian", "childChange": "r3c-frontmatter-diagram-html" },
    { "task": "9.1", "owner": "@xian", "childChange": "r4a-input-integrity" },
    { "task": "9.2", "owner": "@xian", "childChange": "r4a-input-integrity" },
    { "task": "9.3", "owner": "@xian", "childChange": "r4a-input-integrity" },
    { "task": "9.4", "owner": "@xian", "childChange": "r4a-input-integrity" },
    { "task": "9.5", "owner": "@xian", "childChange": "r4a-input-integrity" },
    { "task": "9.6", "owner": "@xian", "childChange": "r4a-input-integrity" },
    { "task": "9.7", "owner": "@xian", "childChange": "r4a-input-integrity" },
    { "task": "9.8", "owner": "@xian", "childChange": "r4a-input-integrity" },
    { "task": "9.9", "owner": "@xian", "childChange": "r4a-input-integrity" },
    { "task": "9.10", "owner": "@xian", "childChange": "r4a-input-integrity" },
    { "task": "9.11", "owner": "@xian", "childChange": "r4a-input-integrity" },
    { "task": "10.1", "owner": "@xian", "childChange": "r4b-performance-security" },
    { "task": "10.2", "owner": "@xian", "childChange": "r4b-performance-security" },
    { "task": "10.3", "owner": "@xian", "childChange": "r4b-performance-security" },
    { "task": "10.4", "owner": "@xian", "childChange": "r4b-performance-security" },
    { "task": "10.5", "owner": "@xian", "childChange": "r4b-performance-security" },
    { "task": "10.6", "owner": "@xian", "childChange": "r4b-performance-security" },
    { "task": "10.7", "owner": "@xian", "childChange": "r4b-performance-security" },
    { "task": "10.8", "owner": "@xian", "childChange": "r4b-performance-security" },
    { "task": "11.1", "owner": "@xian", "childChange": "r5a-desktop-visual-platform" },
    { "task": "11.2", "owner": "@xian", "childChange": "r5a-desktop-visual-platform" },
    { "task": "11.3", "owner": "@xian", "childChange": "r5a-desktop-visual-platform" },
    { "task": "11.4", "owner": "@xian", "childChange": "r5a-desktop-visual-platform" },
    { "task": "11.5", "owner": "@xian", "childChange": "r5a-desktop-visual-platform" },
    { "task": "11.6", "owner": "@xian", "childChange": "r5a-desktop-visual-platform" },
    { "task": "11.7", "owner": "@xian", "childChange": "r5a-desktop-visual-platform" },
    { "task": "11.8", "owner": "@xian", "childChange": "r5a-desktop-visual-platform" },
    { "task": "11.9", "owner": "@xian", "childChange": "r5a-desktop-visual-platform" },
    { "task": "11.10", "owner": "@xian", "childChange": "r5a-desktop-visual-platform" },
    { "task": "11.11", "owner": "@xian", "childChange": "r5b-stability-observation" },
    { "task": "12.1", "owner": "@xian", "childChange": "r5c-cleanup-archive" },
    { "task": "12.2", "owner": "@xian", "childChange": "r5c-cleanup-archive" },
    { "task": "12.3", "owner": "@xian", "childChange": "r5c-cleanup-archive" },
    { "task": "12.4", "owner": "@xian", "childChange": "r5c-cleanup-archive" },
    { "task": "12.5", "owner": "@xian", "childChange": "r5c-cleanup-archive" },
    { "task": "12.6", "owner": "@xian", "childChange": "r5c-cleanup-archive" },
    { "task": "12.7", "owner": "@xian", "childChange": "r5c-cleanup-archive" },
    { "task": "12.8", "owner": "@xian", "childChange": "r5c-cleanup-archive" },